{"boot_id":"boot-A","capability_digest":"sha256:dddddddddddddddddddddddddddddddddddddddddddddddddddddddddddddddd","current_output":{"energized":false,"operation":"set_pwm_lease","target":"fan-01","value":0},"dedup_ledger":{"persistent":false,"size":0},"device_id":"dev-01","firmware_digest":"sha256:cccccccccccccccccccccccccccccccccccccccccccccccccccccccccccccccc","message_type":"state","protocol_version":1,"safe_state":true}
